gbifID,identifier,references,VF,institutionID,collectionID,datasetID,institutionCode,basisOfRecord,informationWithheld,occurrenceID,catalogNumber,recordNumber,recordedBy,sex,lifeStage,reproductiveCondition,behavior,establishmentMeans,occurrenceStatus,associatedMedia,associatedReferences,associatedTaxa,otherCatalogNumbers,organismID,eventDate,Date_2,Year_2,Month_2,Day_2,eventTime,startDayOfYear,endDayOfYear,year,month,day,verbatimEventDate,habitat,fieldNotes,country,countryCode,stateProvince,county,municipality,locality,verbatimElevation,decimalLatitude,decimalLongitude,geodeticDatum,coordinateUncertaintyInMeters,verbatimCoordinates,taxonID,scientificName,family,genus,subgenus,specificEpithet,infraspecificEpithet,taxonRank,scientificNameAuthorship,Decade,DOY
2422513785,1691445,https://cch2.org/portal/collections/individual/index.php?occid=1691445,YES,,3818c5b4-b6a4-11e8-b408-001a64db2964,,UCR,PreservedSpecimen,,UCR-BPS-275856,UCR0064096,34571,Jim André,,,Flowering & Fruiting,,,,,,,UCR-275856,,2016-04-21,2016-04-21,2016,04,21,,112,,2016,4,21,2016-4-21,"Rocky north-facing limestone slopes with Buddleja utahensis, Larrea tridentata, Krameria erecta, Ambrosia dumosa, Eremogone macradenia, Amphipappus fremontii, Mentzelia reflexa.",,United States,,California,Inyo,,"Nopah Range, along Spanish Trails Hwy, 0.5 mile west of Emigrant Pass, 10.1 miles east of Tecopa",,35.8846,-116.06438,,,,18101,Eschscholzia glyptosperma,Papaveraceae,Eschscholzia,,glyptosperma,,Species,Greene,2010,112
2422335052,1491253,https://cch2.org/portal/collections/individual/index.php?occid=1491253,YES,,3818c5b4-b6a4-11e8-b408-001a64db2964,,UCR,PreservedSpecimen,,UCR-BPS-15834,UCR0064153,s.n.,Frank C. Vasek,,,Flowering & Fruiting,,,,,,,UCR-15834,,1978-04-22,1978-04-22,1978,04,22,,112,,1978,4,22,1978-4-22,,,United States,,California,San Bernardino,,Sheephole Pass. Site VB,,34.23889,-115.72222,,,T2N R12E sec27,18101,Eschscholzia glyptosperma,Papaveraceae,Eschscholzia,,glyptosperma,,Species,Greene,1970,112
2422332218,1491301,https://cch2.org/portal/collections/individual/index.php?occid=1491301,YES,,3818c5b4-b6a4-11e8-b408-001a64db2964,,UCR,PreservedSpecimen,,UCR-BPS-32288,UCR0064167,2587,Barry A. Prigge,,,Fruiting,,,,,,,UCR-32288,,1978-04-22,1978-04-22,1978,04,22,,112,,1978,4,22,1978-4-22,"Flat area, fine gravelly, granitic soil. Creosote bush scrub with Larrea tridentata, Ambrosa dumosa, Palafoxia linearis, Dalea schottii, Baileya pleniradiata, Achyronychia cooperi, Phacelia crenulata, Camissonia claviformis, etc.",,United States,,California,San Bernardino,,"Budweiser Valley, 13.2 miles west of Kelbaker Road on powerline road",,34.85,-115.86667,,,1E 4N,18101,Eschscholzia glyptosperma,Papaveraceae,Eschscholzia,,glyptosperma,,Species,Greene,1970,112
1986941685,235539,https://intermountainbiota.org/portal/collections/individual/index.php?occid=235539,NO,http://grbio.org/institution/utah-state-university,06bf658d-f555-4c9c-ab93-fc2d7db7086e,,Utah State University,PreservedSpecimen,,USU:UTC:227401,UTC00227401,12095,Ann Pinzl; Paula T. Work ,,,,,,,,,Larrea  Psorothamnus  Ephedra. ,,,1997-04-22,1997-04-22,1997,04,22,,112,,1997,4,22,,,,United States,,Nevada,Clark,,South side of Gale Hills  north of Northshore Road (LMNRA). ,,36.2116667,-114.7283333,,,,467,Eschscholzia glyptosperma,Papaveraceae,Eschscholzia,,glyptosperma,,Species,Greene,1990,112
2982066069,1818044,https://cch2.org/portal/collections/individual/index.php?occid=1818044,YES,,eaef47cb-6ed3-4439-b974-f05e4f65165e,,HSC,PreservedSpecimen,,e40e02c7-c3d3-4d64-b23f-74927684e022,HSC213569,3762,A.C. Sanders,,,,,,,,,,HSC-78507,,1983-04-23,1983-04-23,1983,04,23,,113,,1983,4,23,23 Apr 1983,Desert Microphyll Woodland,,United States,,California,San Bernardino,,"Whipple Mtns., Whipple Wash where it joins the road to Havasu Landing, about 1/2 mi. below Willow Spring and 1 1/4 mi. above Lake Havasu.",,34.37444444,-114.2719444,WGS84,1000,T3N R26E sec5 NE 1/2 of SW 1/4,18101,Eschscholzia glyptosperma,PAP,Eschscholzia,,glyptosperma,,Species,Greene,1980,113
2610077895,3808594,https://cch2.org/portal/collections/individual/index.php?occid=3808594,YES,,3818e1d3-b6a4-11e8-b408-001a64db2964,,RSA,PreservedSpecimen,,8c0cb1e3-1788-4017-b7aa-0fc3570a885e,RSA0146486,32762,Jim M. André,,,flowers,,Native,,,,"Larrea tridentata, Hyptis emoryi, Acacia greggii, Ambrosia dumosa, Viguiera parishii, Fouquieria splendens, Adenophyllum porophylloides",RSA accession #: 871368,,2015-04-23,2015-04-23,2015,04,23,,113,,2015,4,23,,Margin of rocky volcanic wash. Parent rock: volcanic. Geologic formation: alluvium. Soil type: gravel.,,United States,,California,San Bernardino,,"Sacramento Mountains: far southeast end of range, on rough dirt road 1 mi. west of Hwy 95 about 12 mi. south of Needles, 0.8 mi. north of BLM Rd 9003.",1595ft.,34.6785333,-114.6332167,NAD83,,,18101,Eschscholzia glyptosperma,Papaveraceae,Eschscholzia,,glyptosperma,,Species,Greene,2010,113
2422465116,1634887,https://cch2.org/portal/collections/individual/index.php?occid=1634887,YES,,3818c5b4-b6a4-11e8-b408-001a64db2964,,UCR,PreservedSpecimen,,UCR-BPS-217254,UCR0064125,13721,Jim André,,,Flowering & Fruiting,,,,,,,UCR-217254,,2010-04-23,2010-04-23,2010,04,23,,113,,2010,4,23,2010-4-23,"Sandy dunes at edge of large wash, with Chilopsis linearis, Gilia latiflora, Chrysothamnus paniculatus, Larrea tridentata.",,United States,,California,San Bernardino,,"Kelso Dunes, Mojave National Preserve, along powerline access road at south end of dunes, 7.5 miles west of Kelbaker Rd.",,34.87182,-115.77207,,,,18101,Eschscholzia glyptosperma,Papaveraceae,Eschscholzia,,glyptosperma,,Species,Greene,2010,113
2422462575,1634273,https://cch2.org/portal/collections/individual/index.php?occid=1634273,YES,,3818c5b4-b6a4-11e8-b408-001a64db2964,,UCR,PreservedSpecimen,,UCR-BPS-216503,UCR0064129,13724,Jim André,,,Flowering & Fruiting,,,,,,,UCR-216503,,2010-04-23,2010-04-23,2010,04,23,,113,,2010,4,23,2010-4-23,"Sandy banks of wash, granitic alluvium; with Chilopsis linearis, Acacia greggii, Bebbia juncea, Lupinus concinnus.",,United States,,California,San Bernardino,,"Granite Mountains, Mojave National Preserve, along powerline road c. 6 miles SW of Kelso Dunes at Budweiser Wash",,34.86062,-115.83207,,,,18101,Eschscholzia glyptosperma,Papaveraceae,Eschscholzia,,glyptosperma,,Species,Greene,2010,113
2422330534,1491304,https://cch2.org/portal/collections/individual/index.php?occid=1491304,YES,,3818c5b4-b6a4-11e8-b408-001a64db2964,,UCR,PreservedSpecimen,,UCR-BPS-31131,UCR0064149,3762,A.C. Sanders,,,Flowering,,,,,,,UCR-31131,,1983-04-23,1983-04-23,1983,04,23,,113,,1983,4,23,1983-4-23,"Desert microphyll woodland with Olneya, Hyptis, Cercidium, Encelia farinosa, Lycium, and Larrea.",,United States,,California,San Bernardino,,"Whipple Mtns., Whipple Wash where it joins the road to Havasu Landing, c. 0.5 mile below Willow Spring and 1.5 miles above Lake Havasu",,34.37444,-114.27194,,,T3N R26E sec5 NE/4 of SW/4,18101,Eschscholzia glyptosperma,Papaveraceae,Eschscholzia,,glyptosperma,,Species,Greene,1980,113
2422329484,1491307,https://cch2.org/portal/collections/individual/index.php?occid=1491307,YES,,3818c5b4-b6a4-11e8-b408-001a64db2964,,UCR,PreservedSpecimen,,UCR-BPS-25392,UCR0064172,783,John C. Roos,,,Flowering,,,,,,,UCR-25392,,1937-04-23,1937-04-23,1937,04,23,,113,,1937,4,23,1937-4-23,"With Coleogyne ramosissima, Salazaria mexicana and Eschscholzia glyptosperma.",,United States,,California,San Bernardino,,20 miles west of Twentynine Palms [= near Yucca Valley],,34.135,-116.38361,,,,18101,Eschscholzia glyptosperma,Papaveraceae,Eschscholzia,,glyptosperma,,Species,Greene,1930,113
2422329435,1491247,https://cch2.org/portal/collections/individual/index.php?occid=1491247,YES,,3818c5b4-b6a4-11e8-b408-001a64db2964,,UCR,PreservedSpecimen,,UCR-BPS-90689,UCR0064160,2328,B.G. Pitzer,,,Flowering,,,,,,,UCR-90689,,1995-04-23,1995-04-23,1995,04,23,,113,,1995,4,23,1995-4-23,"Dissected alluvial fan; slopes rocky with patches of desert pavement and sandy washes. Creosote bush scrub, with Larrea, Ambrosia dumosa, Hymenoclea salsola, Psorothamnus, Atriplex, Lycium, Opuntia, Ephedra, etc.",,United States,,California,San Bernardino,,"Iron Mountain, c. 15 air miles west of Barstow, between Hinckley Road and Harper Lake Road",,34.87,-117.23667,,,11S 7E 5N; T9N R3W sec18 SW/4,18101,Eschscholzia glyptosperma,Papaveraceae,Eschscholzia,,glyptosperma,,Species,Greene,1990,113
2418039258,2136167,https://cch2.org/portal/collections/individual/index.php?occid=2136167,,,6a942843-3cb1-4643-a475-24df2d2ba49f,,CHSC,PreservedSpecimen,,d57d5583-cdae-44f4-88fb-56c43cb5fd9b,CHSC116968,,B. Mulvey,,,,,,,,,,,,2013-04-23,2013-04-23,2013,04,23,,113,,2013,4,23,04/23/2013,Found in rocky soil on plateau. Herbaceous.,,United States,,California,Fresno,,Table Mountain towards Auberry.,,37.077778,-119.495,,,37§ 4m 40s N; 119§ 29m 42s W,18101,Eschscholzia glyptosperma,Papaveraceae,Eschscholzia,,glyptosperma,,Species,Greene,2010,113
3053362262,92268,https://cch2.org/portal/collections/individual/index.php?occid=92268,YES,,3818e0aa-b6a4-11e8-b408-001a64db2964,,SBBG,PreservedSpecimen,,778ca8b8-535f-438b-a7b3-3d019ae06227,SBBG169414,2088,Donald Myrick,,,Flowers Present; Fruit Present,,,,,,,33292,,1969-04-24,1969-04-24,1969,04,24,,114,,1969,4,24,1969-4-24,desert floor,,United States,,California,San Bernardino,,ca. 15 mi N of Baker along rd to Death Valley,1500 ft ,35.43606,-116.15021,WGS84,5258,,18101,Eschscholzia glyptosperma,Papaveraceae,Eschscholzia,,glyptosperma,,Species,Greene,1960,114
2430553925,983398,https://cch2.org/portal/collections/individual/index.php?occid=983398,YES,,3818e1d3-b6a4-11e8-b408-001a64db2964,,RSA,PreservedSpecimen,,809abbe2-d8b4-4303-8f40-b57e3e6e82de,,8224,Lyman Benson,,,flowers & fruits,,Native,,,,,POM accession #: 272311,,1937-04-24,1937-04-24,1937,04,24,,114,,1937,4,24,,Lower Sonoran. wash soil,,United States,,California,Inyo,,"5 miles south of Ryan, Black Mountain Range; Death Valley.",3000ft.,36.28213,-116.67021,NAD83,400,,18101,Eschscholzia glyptosperma,Papaveraceae,Eschscholzia,,glyptosperma,,Species,Greene,1930,114
2422330398,1491245,https://cch2.org/portal/collections/individual/index.php?occid=1491245,YES,,3818c5b4-b6a4-11e8-b408-001a64db2964,,UCR,PreservedSpecimen,,UCR-BPS-93395,UCR0064138,s.n.,George K. Helmkamp,,,Flowering,,,,,,,UCR-93395,,1993-04-24,1993-04-24,1993,04,24,,114,,1993,4,24,1993-4-24,"Steep rocky canyon with dense growth of shrubs, including Nolina.",,United States,,California,San Bernardino,,"along Smith Talc Road, c. 9 miles east of Tecopa [Pass?, Inyo Co.; probably after Sm. T. Rd. transition to Excelsior Mine Rd.]",,35.79222,-115.96806,,,,18101,Eschscholzia glyptosperma,Papaveraceae,Eschscholzia,,glyptosperma,,Species,Greene,1990,114
1929303227,6ca32f85-7ce9-4dbc-9ffd-fee7180435c6,http://sweetgum.nybg.org/science/vh/specimen_details.php?irn=3949171,YES,http://biocol.org/urn:lsid:biocol.org:col:15556,http://biocol.org/urn:lsid:biocol.org:col:15556,,NY,PreservedSpecimen,,6ca32f85-7ce9-4dbc-9ffd-fee7180435c6,3676002,20567,B. Maguire,,,,,,,,,,,,1941-04-24,1941-04-24,1941,04,24,,11,11,1941,4,24,24 Apr 1941,,,United States of America,,Arizona,Mohave Co.,,"Vicinity of Lake Meed, lower Grand Wash",,36.293633,-113.993146,WGS84,10918,,,Eschscholzia glyptosperma Greene,Papaveraceae,Eschscholzia,,glyptosperma,,Species,Greene,1940,114
2430440571,980368,https://cch2.org/portal/collections/individual/index.php?occid=980368,YES,,3818e1d3-b6a4-11e8-b408-001a64db2964,,RSA,PreservedSpecimen,,7f2c3925-525f-4b78-b49e-25e7ff346842,,6630,I. W. Clokey,,,flowers & fruits,,Native,,,,,POM accession #: 250475,,1935-04-25,1935-04-25,1935,04,25,,115,,1935,4,25,,,,United States,,California,San Bernardino,,12 miles N of Hinkley,2952ft.,35.08255,-117.24815,WGS84,1147,,18101,Eschscholzia glyptosperma,Papaveraceae,Eschscholzia,,glyptosperma,,Species,Greene,1930,115
2430137318,1109811,https://cch2.org/portal/collections/individual/index.php?occid=1109811,YES,,3818e1d3-b6a4-11e8-b408-001a64db2964,,RSA,PreservedSpecimen,,bce3b886-2832-4014-8ce0-2c6e21bc73fa,,1493,"Justin M. Wood; R. Goodman, M. Cady",,,flowers,,Native,,,,,RSA accession #: 768651,,2010-04-25,2010-04-25,2010,04,25,,115,,2010,4,25,,Creosote bush scrub and sandy desert wash.,,United States,,California,San Bernardino,,"BLMNorth of Barstow, Mud Hills - Owl Canyon, near the campground.; Mud Hills",3000-3050ft.,35.0191667,-117.0208333,,,T11N R2W S30 NE1/4,18101,Eschscholzia glyptosperma,Papaveraceae,Eschscholzia,,glyptosperma,,Species,Greene,2010,115
2270540308,20958250,https://swbiodiversity.org/seinet/collections/individual/index.php?occid=20958250,,,a2e32c87-d320-4a01-bafd-a9182ae2e191,,ASU,PreservedSpecimen,,32bbe74e-7f2f-40e1-8bf0-5662bdb6f3a3,ASU0118224,14683,A. Tiehm,,,,,,,,,"Larrea, Ambrosia",265152,,2005-04-25,2005-04-25,2005,04,25,,115,,2005,4,25,,On sandy flats.,,USA,,Nevada,Nye,,"2.1 road miles S of Oasis Valley Road, on road on E side of hills on E side of the Amargosa River, then 1.5 road miles E.",3960 ft.,37.009833,-116.690167,WGS84,,"TRS: T11S R47E sec 2; 37° 00' 35.4"" N 116° 41' 24.6"" W",467,Eschscholzia glyptosperma,Papaveraceae,Eschscholzia,,glyptosperma,,Species,Greene,2000,115
2270189923,183275,https://cch2.org/portal/collections/individual/index.php?occid=183275,YES,,3818d95b-b6a4-11e8-b408-001a64db2964,,OBI,PreservedSpecimen,,58369eb0-4f69-4606-a299-d722670cdd14,OBI103758,20006,David J. Keil,,,,,,,,,,43677,,1987-04-25,1987-04-25,1987,04,25,,115,,1987,4,25,25-Apr-87,"Broad, flat wash crossing the hwy. Creosote bush scrub area; Occ",,United States,,California,San Bernardino,,6.6 mi SE ofj ctn with I-15 along Kelbaker Rd,1600ft.,35.25507,-115.958159,WGS84,456,,18101,Eschscholzia glyptosperma,Papaveraceae,Eschscholzia,,glyptosperma,,Species,Greene,1980,115
1986958842,253992,https://intermountainbiota.org/portal/collections/individual/index.php?occid=253992,,http://grbio.org/institution/utah-state-university,06bf658d-f555-4c9c-ab93-fc2d7db7086e,,Utah State University,PreservedSpecimen,,USU:UTC:247548,UTC00247548,14683,Arnold Tiehm,,,,,,,,,,,,2005-04-25,2005-04-25,2005,04,25,,115,,2005,4,25,,"Plants growing with Larrea, Ambrosia on sandy flats, flowers yellow.",,United States,,Nevada,Nye,,"2.1 road miles S of Oasis Valley Road on road on E side of hills on E side of the Amargosa River, them 1.5 road miles E.",,37.0097222,-116.69,,,,467,Eschscholzia glyptosperma,Papaveraceae,Eschscholzia,,glyptosperma,,Species,Greene,2000,115
1929275407,6aab7f12-8245-4f52-9f51-36fe1d233124,http://sweetgum.nybg.org/science/vh/specimen_details.php?irn=907579,,http://biocol.org/urn:lsid:biocol.org:col:15556,http://biocol.org/urn:lsid:biocol.org:col:15556,,NY,PreservedSpecimen,,6aab7f12-8245-4f52-9f51-36fe1d233124,758495,14683,A. Tiehm,,,,,,,,,,,,2005-04-25,2005-04-25,2005,04,25,,11,11,2005,4,25,25 Apr 2005,Growing on sandy flats,,United States of America,,Nevada,Nye Co.,,"2.1 road miles south of Oasis Valley Road on road on east side of hills on east side of the Amargosa River, then 1.5 road miles east",3960 ft,37.0098333,-116.6901667,,,,,Eschscholzia glyptosperma Greene,Papaveraceae,Eschscholzia,,glyptosperma,,Species,Greene,2000,115
3053348304,52655,https://cch2.org/portal/collections/individual/index.php?occid=52655,YES,,3818e0aa-b6a4-11e8-b408-001a64db2964,,SBBG,PreservedSpecimen,,284743d9-6d7f-4b72-b764-523a4d534ccb,SBBG169411,157,S. Schroer,,,Flowers Present; Fruit Present,,,,,,,55800,,1973-04-26,1973-04-26,1973,04,26,,116,,1973,4,26,1973-4-26,,,United States,,California,Inyo,,"Ibex Pass between Baker and Shoshone, Amargosa River drainage",2000 ft ,35.795,-116.339,NAD83,1000,,18101,Eschscholzia glyptosperma,Papaveraceae,Eschscholzia,,glyptosperma,,Species,Greene,1970,116
2430485789,767543,https://cch2.org/portal/collections/individual/index.php?occid=767543,YES,,3818e1d3-b6a4-11e8-b408-001a64db2964,,RSA,PreservedSpecimen,,3d9bd9d0-52dc-406b-a833-e0f4022f86c8,,s.n.,H. Green; Lorin Hicks,,,flowers & fruits,,Native,,,,,RSA accession #: 518506,,1978-04-26,1978-04-26,1978,04,26,,116,,1978,4,26,,"Creosote bush scrub on valley floor; with Ambrosia dumosa, Hymenoclea salsola, Dalea (Psorothamnus) spinosa, Encelia frutescens, E. farinosa, and many annuals and perennials. Tortoise study for B.L.M., contract #CA-060-CT8-000031",,United States,,California,San Bernardino,,"Ward Valley, W of Needles.",,34.30517,-115.06028,WGS84,800,11S 7E 9N; T3N R18E S35,18101,Eschscholzia glyptosperma,Papaveraceae,Eschscholzia,,glyptosperma,,Species,Greene,1970,116
2430318169,1237403,https://cch2.org/portal/collections/individual/index.php?occid=1237403,YES,,3818e1d3-b6a4-11e8-b408-001a64db2964,,RSA,PreservedSpecimen,,f9dd7ab8-a987-45ea-a47b-bf7c7e35c3d3,,95,"S. Castagnoli; Greg de Nevers, R. D. Stone",,,flowers & fruits,,Native,,,,,RSA accession #: 296994,,1980-04-25,1980-04-25,1980,04,25,,116,,1980,4,25,,"Rocky, sandy S facing",,United States,,California,San Bernardino,,Kingstone Range. Coyote Holes.,2200ft.,35.641067,-115.959083,WGS84,1000,,18101,Eschscholzia glyptosperma,Papaveraceae,Eschscholzia,,glyptosperma,,Species,Greene,1980,116
2422465731,1636203,https://cch2.org/portal/collections/individual/index.php?occid=1636203,YES,,3818c5b4-b6a4-11e8-b408-001a64db2964,,UCR,PreservedSpecimen,,UCR-BPS-218856,UCR0064127,12885,Jim André,,,Flowering & Fruiting,,,,,,,UCR-218856,,2010-04-26,2010-04-26,2010,04,26,,116,,2010,4,26,2010-4-26,"Limestone, with Yucca brevifolia, Mortonia utahensis, Salvia dorrii, Cryptantha barbigera.",,United States,,California,San Bernardino,,"Mesquite Mountains, along south side of Kingston Road c. 1 mi northwest of Winters Pass",,35.7018,-115.70135,,,,18101,Eschscholzia glyptosperma,Papaveraceae,Eschscholzia,,glyptosperma,,Species,Greene,2010,116
2270190545,183217,https://cch2.org/portal/collections/individual/index.php?occid=183217,YES,,3818d95b-b6a4-11e8-b408-001a64db2964,,OBI,PreservedSpecimen,,7faa6616-4fea-4868-bad2-8b0270711588,OBI103757,s.n.,David J. Keil,,,,,,,,,,70460,,1992-04-25,1992-04-25,1992,04,25,,116,,1992,4,25,25-Apr-92,Open creosote bush scrub on gradually sloping hillside with desert pavement,,United States,,California,San Bernardino,,"Afton Rd, ca 1 mi SE of I-15",,35.0623,-116.3997,WGS84,1000,,18101,Eschscholzia glyptosperma,Papaveraceae,Eschscholzia,,glyptosperma,,Species,Greene,1990,116
2430402449,898415,https://cch2.org/portal/collections/individual/index.php?occid=898415,YES,,3818e1d3-b6a4-11e8-b408-001a64db2964,,RSA,PreservedSpecimen,,582349e9-1590-4006-8412-c45bd7cb0b80,,6480,Carl B. Wolf,,,flowers & fruits,,Native,,,,,RSA accession #: 12939,,1935-04-27,1935-04-27,1935,04,27,,117,,1935,4,27,,"Sun, gravel, open desert valley, Lower Sonoran - Larrea belt.",,United States,,California,San Bernardino,,Mojave Desert. 3.7 miles North of Barstow on the Garlic Springs road.,2300ft.,34.9568056,-117.0188056,,,,18101,Eschscholzia glyptosperma,Papaveraceae,Eschscholzia,,glyptosperma,,Species,Greene,1930,117
2422463174,1635131,https://cch2.org/portal/collections/individual/index.php?occid=1635131,YES,,3818c5b4-b6a4-11e8-b408-001a64db2964,,UCR,PreservedSpecimen,,UCR-BPS-217750,UCR0064128,12828,Jim André,,,Flowering & Fruiting,,,,,,,UCR-217750,,2010-04-27,2010-04-27,2010,04,27,,117,,2010,4,27,2010-4-27,"Gravelly south-facing slopes with Yucca schidigera, Krameria erecta, Larrea tridentata, Ambrosia dumosa, Delphinium parishii.",,United States,,California,San Bernardino,,"Ivanpah Mountains, Mojave National Preserve, in the vicinity of Mineral Spring, c. 4 miles north of Morningstar Mine Road, 1.8 air miles ESE of Kokoweef Peak",,35.41112,-115.46342,,,,18101,Eschscholzia glyptosperma,Papaveraceae,Eschscholzia,,glyptosperma,,Species,Greene,2010,117
3125263351,1976385,https://cch2.org/portal/collections/individual/index.php?occid=1976385,YES,,0945030a-f625-4b95-9f48-e5cb7d6eb879,,SD,PreservedSpecimen,,324EAF1B-9B47-4D42-8B4B-CA3FA33E8E0E,SD00032938,1405,Andrew Salywon; John Anderson,,,FFL,,,,,,"Common, with Larrea tridentata.",SD188512,,2003-04-28,2003-04-28,2003,04,28,,118,,2003,4,28,"Apr 28, 2003",,,United States,,Arizona,Yavapai,,"Anderson Mine, ca. 5.0 miles west of Highway 93 on Alamo Lake Road, then north on old Alamo Lake Road and west across Date Creek and north to Anderson Mine.",,34.30567,-113.441,WGS84,,,18101,Eschscholzia glyptosperma,Papaveraceae,Eschscholzia,,glyptosperma,,Species,Greene,2000,118
3091249474,2125597,https://swbiodiversity.org/seinet/collections/individual/index.php?occid=2125597,,,17a53c97-835b-409e-8a9a-c9a7307a4965,,ASC,PreservedSpecimen,,eea42536-4552-4d28-bfa2-8867f08d07b1,ASC00091717,1405,Andrew Salywon; John Anderson,,,,,,,,,"Larrea tridentata, Opuntia basilaris, Ambrosia dumosa, Cylindropuntia bigelovii, Cylindropuntia acanthocarpa, Fouqueria splendens & Yucca brevifolia.",,,2003-04-28,2003-04-28,2003,04,28,,118,,2003,4,28,,,,United States,,Arizona,Yavapai,,"Anderson Mine, ca. 5 miles W of Hwy 93 on Alamo Lake Road, then N on old Alamo Lake Rd & W across Date Creek and N to Anderson Mine.",1860ft.,34.305667,-113.274333,,,34d 18.34m s N 113d 16.46m s W,467,Eschscholzia glyptosperma,Papaveraceae,Eschscholzia,,glyptosperma,,Species,Greene,2000,118
3079904733,72975303,https://www.inaturalist.org/observations/72975303,,,,,iNaturalist,HumanObservation,,https://www.inaturalist.org/observations/72975303,72975303,,Rob Ferber,,,,,wild,,,,,,,2017-04-28T15:14:00-07:00,2017-04-28,2017,04,28,22:14:00Z,,,,,,2017/04/28 3:14 PM PDT,,,,US,Nevada,,,,,36.43159095,-114.9598251,,15,,77083,Eschscholzia glyptosperma,Papaveraceae,Eschscholzia,,,,species,,2010,118
3053451729,101649,https://cch2.org/portal/collections/individual/index.php?occid=101649,YES,,3818e0aa-b6a4-11e8-b408-001a64db2964,,SBBG,PreservedSpecimen,,8aa767a2-2e7b-4624-8e21-8a79c2af4dba,SBBG169424,419,H. and M. Dearing,,,Flowers Present; Fruit Present,,,,,,,2337,,1937-04-28,1937-04-28,1937,04,28,,118,,1937,4,28,1937-4-28,,,United States,,California,San Bernardino,,Granite Wells Rd near Barstow,,34.984,-116.999,NAD83,,,18101,Eschscholzia glyptosperma,Papaveraceae,Eschscholzia,,glyptosperma,,Species,Greene,1930,118
2430462679,722056,https://cch2.org/portal/collections/individual/index.php?occid=722056,YES,,3818e1d3-b6a4-11e8-b408-001a64db2964,,RSA,PreservedSpecimen,,280ec8d9-7fdd-4d25-87e3-de9b04b4e872,,741,Barry A. Prigge,,,flowers & fruits,,Native,,,,,RSA accession #: 269629,,1973-04-28,1973-04-28,1973,04,28,,118,,1973,4,28,,Gravelly soil.,,United States,,California,San Bernardino,,"Clark Mt Range, 5 miles E of Mt Pass, 0.8 miles W of I-15 X Nipton Rd.",3400ft.,35.465619,-115.459352,WGS84,1200,,18101,Eschscholzia glyptosperma,Papaveraceae,Eschscholzia,,glyptosperma,,Species,Greene,1970,118
2430307632,1226776,https://cch2.org/portal/collections/individual/index.php?occid=1226776,YES,,3818e1d3-b6a4-11e8-b408-001a64db2964,,RSA,PreservedSpecimen,,f4d44366-f98a-4af7-bad9-6cb9098b3abb,,43254,Robert F. Thorne,,,flowers & fruits,,Native,,,,,RSA accession #: 252040,,1973-04-28,1973-04-28,1973,04,28,,118,,1973,4,28,,"On rocky S-facing canyon slope with Yucca schidigera, Salazaria, Prunus fasciculata, Rhamnus spp., Viguiera, Opuntia spp., Penstemon, Euphorbia incisa, etc,",,United States,,California,San Bernardino,,"Providence Mountains, Canyon above Cornfield Springs.",3800-4000ft.,34.969814,-115.569865,WGS84,600,,18101,Eschscholzia glyptosperma,Papaveraceae,Eschscholzia,,glyptosperma,,Species,Greene,1970,118
2422448030,1621529,https://cch2.org/portal/collections/individual/index.php?occid=1621529,YES,,3818c5b4-b6a4-11e8-b408-001a64db2964,,UCR,PreservedSpecimen,,UCR-BPS-203803,,1405,Andrew Salywon; John Anderson,,,Flowering & Fruiting,,,,,,,UCR-203803,,2003-04-28,2003-04-28,2003,04,28,,118,,2003,4,28,2003-4-28,"Assoc. with Larrea tridentata, Opuntia basilaris, ambrosia dumosa, Cylindropuntia begelovii, Cylindropuntia acanthocarpa, Fouquieria splendens, Yucca brevifolia.",,United States,,Arizona,Yavapai,,"Anderson Mine, c. 5 mi west of Hwy 93 on Alamo Lake Road, then north on old Alamo Lake Road and west across Date Creek and north to Anderson Mine",,34.30556,-113.27444,,,,18101,Eschscholzia glyptosperma,Papaveraceae,Eschscholzia,,glyptosperma,,Species,Greene,2000,118
1846479473,1088364,https://swbiodiversity.org/seinet/collections/individual/index.php?occid=1088364,,,edb9860c-c481-4d19-88cc-224a536ebcd4,,DES,PreservedSpecimen,,003c0848-b655-432f-a9e0-6eb19d08c7cd,DES00060241,1405,Andrew Salywon; John Anderson,,,,,,,,,"Larrea tridentata, Opuntia basilaris, Ambrosia dumosa, Cylindropuntia bigelovii, Cylindropuntia acanthocarpa, Fouqueria splendens & Yucca brevifolia.",,,2003-04-28,2003-04-28,2003,04,28,,118,,2003,4,28,,,,USA,,Arizona,Yavapai County,,"Anderson Mine, ca. 5 miles W of Hwy 93 on Alamo Lake Road, then N on old Alamo Lake Rd & W across Date Creek and N to Anderson Mine.",1860ft.,34.305667,-113.274333,,,34d 18.34m N; 113d 16.46m W,467,Eschscholzia glyptosperma,Papaveraceae,Eschscholzia,,glyptosperma,,Species,Greene,2000,118
2430268897,1199215,https://cch2.org/portal/collections/individual/index.php?occid=1199215,YES,,3818e1d3-b6a4-11e8-b408-001a64db2964,,RSA,PreservedSpecimen,,e7af6a15-e58a-4ce7-a345-d1a6a8aa5106,,43271,Robert F. Thorne,,,flowers & fruits,,Native,,,,,RSA accession #: 248030,,1973-04-29,1973-04-29,1973,04,29,,119,,1973,4,29,,"Creosote bush scrub with Larrea, Ambrosia dumosa, Opuntia ramosissima, O. basalaris, Thamnosma montana, Eriophyllum and Pectocarya spp.m Streptanthella, Rafinesquia neomexicana, Dyssodia porophylloides, Dithyraea, etc.",,United States,,California,San Bernardino,,"7.5 miles SSW of Cima, 2 miles along road to Marl Mountains (Kelso Peak).",3700ft.,35.18468,-115.5571,WGS84,5100,,18101,Eschscholzia glyptosperma,Papaveraceae,Eschscholzia,,glyptosperma,,Species,Greene,1970,119
