gbifID,identifier,references,VF,institutionID,collectionID,datasetID,institutionCode,basisOfRecord,informationWithheld,occurrenceID,catalogNumber,recordNumber,recordedBy,sex,lifeStage,reproductiveCondition,behavior,establishmentMeans,occurrenceStatus,associatedMedia,associatedReferences,associatedTaxa,otherCatalogNumbers,organismID,eventDate,Date_2,Year_2,Month_2,Day_2,eventTime,startDayOfYear,endDayOfYear,year,month,day,verbatimEventDate,habitat,fieldNotes,country,countryCode,stateProvince,county,municipality,locality,verbatimElevation,decimalLatitude,decimalLongitude,geodeticDatum,coordinateUncertaintyInMeters,verbatimCoordinates,taxonID,scientificName,family,genus,subgenus,specificEpithet,infraspecificEpithet,taxonRank,scientificNameAuthorship,Decade,DOY
2430538444,948081,https://cch2.org/portal/collections/individual/index.php?occid=948081,YES,,3818e1d3-b6a4-11e8-b408-001a64db2964,,RSA,PreservedSpecimen,,6fe00ed2-4743-4b4e-ac06-5f00ae8912ca,,735-2,Aaron Liston; S. Meury,,,flowers,,Native,,,,,RSA accession #: 481925,,1988-04-18,1988-04-18,1988,04,18,,109,,1988,4,18,,,,United States,,California,Inyo,,10 miles S of Dunmovin; W side of Hwy 395.,3280ft.,35.9516667,-117.9088889,,,,206144,Syntrichopappus fremontii,Asteraceae,Syntrichopappus,,fremontii,,Species,A. Gray,1980,109
2430456570,710460,https://cch2.org/portal/collections/individual/index.php?occid=710460,YES,,3818e1d3-b6a4-11e8-b408-001a64db2964,,RSA,PreservedSpecimen,,228854aa-bdc5-492f-b7fa-10b94a3583a5,RSA0084971,26306,Jim André,,,flowers,,Native,,,,"Purshia tridentata glandulosa, Astragalus lentiginosus fremontii, Phacelia distans, Fallugia paradoxa, Verbena gooddingii, Ericameria linearifolia",RSA accession #: 842182,,2013-04-19,2013-04-19,2013,04,19,,109,,2013,4,19,,"Gravelly (volcanic) north-facing slope, and flats, post 2005 burn (patchy).",,United States,,California,San Bernardino,,"NPSMid Hills: along Wildhorse Cyn Rd, 6.0 mi south of Mid Hills Camground, approx 2 mi. northwest of Hole-in-the-Wall Visitor's Crt.; Columbia Mountain 7.5'",4628ft.,35.0563833,-115.4402333,NAD83,,,206144,Syntrichopappus fremontii,Asteraceae,Syntrichopappus,,fremontii,,Species,A. Gray,2010,109
2430354964,666767,https://cch2.org/portal/collections/individual/index.php?occid=666767,YES,,3818e1d3-b6a4-11e8-b408-001a64db2964,,RSA,PreservedSpecimen,,0dd23152-e7c8-4205-b076-b4a982eccfaf,RSA0123341,9385,Duncan S. Bell,,,flowers,,Native,,,,"Quercus cornelius-mulleri, Yucca brevifolia, Eriodictyon trichocalyx, Heperoyucca whipplei, Ericameria linearifolia, Opuntia basilaris, Echinocereus engelmanii, Eriophyllum confertiflorum, Scuttelaria mexicana, Hymenoclea salsola, Ambrosia dumosa, Dichelostemma capitatum, Calochortus kennedyi, etc.",RSA accession #: 864564,,2016-04-18,2016-04-18,2016,04,18,,109,,2016,4,18,,Volcanic extrusion in granitic hills. Common on rocky/silty volcanic outcrop.,,United States,,California,San Bernardino,,"The Wildlands ConservancySawtooth Mountains; northwestern section of range, approximately 3 air miles west northwest of Pioneertown, or about 1.5 air miles northeast of Chaparrosa Peak.; Rimrock",4840ft.,34.16327,-116.54708,,,T1N R4E S22,206144,Syntrichopappus fremontii,Asteraceae,Syntrichopappus,,fremontii,,Species,A. Gray,2010,109
2430351694,766033,https://cch2.org/portal/collections/individual/index.php?occid=766033,YES,,3818e1d3-b6a4-11e8-b408-001a64db2964,,RSA,PreservedSpecimen,,3ce4be16-ae6a-4ff7-86f2-523a4d5cb8eb,,3395,"Duncan S. Bell; Kim Clark, Lucy Clark, Clyde Golden, Jen Laycock, Andrew Seymour, Amber Swanson",,,flowers,,Native,,,,,RSA accession #: 787841,,2012-04-18,2012-04-18,2012,04,18,,109,,2012,4,18,,"Collecting in large rugged granitic outcroppings with springs. Associated with Yucca brevifolia, Coleogyne ramosissima, Sphaeralcea ambigua, Brickellia desertorum, Opuntia basilaris, Xylorhiza tortifolia, Lotus rigidus, Purshia tridentata, Pectocarya setosa, Ericameria cuneata ssp. spathulata, Artemisia ludoviciana, ect.",,United States,,California,Inyo,,"The Argus Range; Great Falls Basin area, approximately 1.5 air miles northeast of Argus Peak.; Trona West",4360ft.,35.86412,-117.42614,,,T24S R42E S10,206144,Syntrichopappus fremontii,Asteraceae,Syntrichopappus,,fremontii,,Species,A. Gray,2010,109
2430294386,1218638,https://cch2.org/portal/collections/individual/index.php?occid=1218638,YES,,3818e1d3-b6a4-11e8-b408-001a64db2964,,RSA,PreservedSpecimen,,f0f0b9c7-cd78-4a22-b57a-4ca71ffff080,,1956,LeRoy Gross,,,flowers & fruits,,Native,,,,,RSA accession #: 707285,,2005-04-19,2005-04-19,2005,04,19,,109,,2005,4,19,,,,United States,,California,San Bernardino,,"Rodman Moutains; South end of a large lava flow, between Camp Rock Mine to the west and Silver Bell Mine to the east.; Silver Bell Mine 7.5 Quad.",4533ft.,34.67221,-116.60894,NAD27,,T7N R4E S30 NW1/4 of NW1/4,206144,Syntrichopappus fremontii,Asteraceae,Syntrichopappus,,fremontii,,Species,A. Gray,2000,109
2430051206,1021559,https://cch2.org/portal/collections/individual/index.php?occid=1021559,YES,,3818e1d3-b6a4-11e8-b408-001a64db2964,,RSA,PreservedSpecimen,,92ac1a23-d679-46e8-8b74-becc216a7509,RSA0093807,37938,A. C. Sanders,,,flowers,,Native,,,,Eriogonum fasciculatum polif. and many annuals.,RSA accession #: 847658,,2010-04-19,2010-04-19,2010,04,19,,109,,2010,4,19,,"Near toe of S-facing hill slope, just above road; decomposed granite weathering to clay-loam soil.",,United States,,California,Kern,,"Southern Foothills of Tehachapi Mountains. hills and canyons c. 1 mile east of Canyon del Gato Montes, north of the end of 265th St. West, N of the dirt road going NE toward Sacatara Creek.; Liebre Twins 7.5' Q.",3981ft.,34.90067,-118.59306,,,,206144,Syntrichopappus fremontii,Asteraceae,Syntrichopappus,,fremontii,,Species,A. Gray,2010,109
2422518269,1691873,https://cch2.org/portal/collections/individual/index.php?occid=1691873,YES,,3818c5b4-b6a4-11e8-b408-001a64db2964,,UCR,PreservedSpecimen,,UCR-BPS-276265,,34440,Jim André,,,Flowering,,,,,,,UCR-276265,,2016-04-18,2016-04-18,2016,04,18,,109,,2016,4,18,2016-4-18,"Joshua Tree Woodland, mixed coarse gravels, desert pavement, with Larrea tridentata, Ambrosia dumosa, Yucca brevifolia, Grusonia parishii, Krameria erecta, Chaetopappa ericoides, Chaenactis carphoclinia, Eriophyllum pringlei, Ephedra nevadensis.",,United States,,California,San Bernardino,,"Castle Mountains, newly designated CM National Monument, fenceline road just south of southernmost hill of mine tailings, c. 2.5 miles southwest of Hart Mine area",,35.26178,-115.10147,,,,206144,Syntrichopappus fremontii,Asteraceae,Syntrichopappus,,fremontii,,Species,A. Gray,2010,109
2422462257,1632021,https://cch2.org/portal/collections/individual/index.php?occid=1632021,YES,,3818c5b4-b6a4-11e8-b408-001a64db2964,,UCR,PreservedSpecimen,,UCR-BPS-214085,,37938,A.C. Sanders,,,Flowering,,,,,,,UCR-214085,,2010-04-19,2010-04-19,2010,04,19,,109,,2010,4,19,2010-4-19,"Near toe of S-facing hill slope, just above road; decomposed granite weathering to clay-loam soil; with Eriogonum fasciculatum polif. and many annuals.",,United States,,California,Kern,,"hills and canyons c. 1 mile east of Canyon del Gato Montes, north of the end of 265th St. West, N of the dirt road going NE toward Sacatara Creek",,34.90067,-118.59306,,,,206144,Syntrichopappus fremontii,Asteraceae,Syntrichopappus,,fremontii,,Species,A. Gray,2010,109
2422454212,1625906,https://cch2.org/portal/collections/individual/index.php?occid=1625906,YES,,3818c5b4-b6a4-11e8-b408-001a64db2964,,UCR,PreservedSpecimen,,UCR-BPS-208726,,10515,Jim André; Jeff B. Galvin,,,Flowering,,,,,,,UCR-208726,,2009-04-19,2009-04-19,2009,04,19,,109,,2009,4,19,2009-4-19,"Wash with Ambrosia salsola, Chilopsis linearis, Cirsium neomexicanum, Plagiobothrys jonesii, Phacelia pedicellata. Lycium cooperi, Camissonia refracta,.",,United States,,California,San Bernardino,,"Newberry Mountains, along Troy Road (dirt) at the junction of Kane Wash and large basalt flow",,34.74639,-116.66639,,,,206144,Syntrichopappus fremontii,Asteraceae,Syntrichopappus,,fremontii,,Species,A. Gray,2000,109
2422442159,1611333,https://cch2.org/portal/collections/individual/index.php?occid=1611333,YES,,3818c5b4-b6a4-11e8-b408-001a64db2964,,UCR,PreservedSpecimen,,UCR-BPS-192164,,34967,A.C. Sanders,,,Flowering,,,,,,,UCR-192164,,2008-04-18,2008-04-18,2008,04,18,,109,,2008,4,18,2008-4-18,"In hills, N-facing slope in Quercus douglasii grove; pale gravelly loam soil; assoc. with Claytonia parviflora, C. exigua, Ancistrocarphus, Syntrichopappus fremontii, Senecio breweri, Thysanocarpus curvipes, Calochortus venustus, Linanthus androsaceus, Microseris lindleyi, Poa secunda, etc.",,United States,,California,Los Angeles,,"Cow Spring Canyon, west side of canyon toward mouth",,34.77,-118.64194,,,11S 0349767E 3848769N; T8N R17W sec24,206144,Syntrichopappus fremontii,Asteraceae,Syntrichopappus,,fremontii,,Species,A. Gray,2000,109
2382621712,375041,https://cch2.org/portal/collections/individual/index.php?occid=375041,YES,,3818d002-b6a4-11e8-b408-001a64db2964,,SDSU,PreservedSpecimen,,7d9f493b-a0e1-46cb-9310-3a6a5e56b323,00562,3213,"Howe, D.F.",,,,,,,,,,SDSU00562,,1962-04-19,1962-04-19,1962,04,19,,109,,1962,4,19,04/19/1962,,,United States,,California,Kern,,15.4 miles south of junction with #395 on #6.,3200ft.,35.484816,-117.956157,WGS84,1200,,206144,Syntrichopappus fremontii,Asteraceae,Syntrichopappus,,fremontii,,Species,A. Gray,1960,109
1500279719,5856611,https://www.inaturalist.org/observations/5856611,YES,,,,iNaturalist,HumanObservation,,https://www.inaturalist.org/observations/5856611,5856611,,c-137,,,,,wild,,,,,,,2017-04-19T11:17:05-07:00,2017-04-19,2017,04,19,18:17:05Z,,,,,,2017-04-19 11:17:05 AM PDT,,,,US,California,,,,,34.80291748,-115.6117554,EPSG:4326,,,79308,Syntrichopappus fremontii,Asteraceae,Syntrichopappus,,,,species,,2010,109
2430215536,645126,https://cch2.org/portal/collections/individual/index.php?occid=645126,YES,,3818e1d3-b6a4-11e8-b408-001a64db2964,,RSA,PreservedSpecimen,,0387a54a-14e8-4ebf-acef-22c9273abcc3,,s.n.,L. C. Wheeler,,,flowers,,Native,,,,,RSA accession #: 618733,,1973-04-20,1973-04-20,1973,04,20,,110,,1973,4,20,,"Sunny, lightly bulldozed gravelly north slope with Juniperus californica, Eriogonum fasciculatum var. polifolium, etc.",,United States,,California,Los Angeles,,San Gabriel Mountains: Aliso Canyon approximately 1/2 mile east of Blum Ranch.,3100ft.,34.4497222,-118.1583333,,,T4N R12W S8 NW1/4 of NW1/4,206144,Syntrichopappus fremontii,Asteraceae,Syntrichopappus,,fremontii,,Species,A. Gray,1970,110
2430204512,1177605,https://cch2.org/portal/collections/individual/index.php?occid=1177605,YES,,3818e1d3-b6a4-11e8-b408-001a64db2964,,RSA,PreservedSpecimen,,dd509910-5d05-405e-a35c-d63a722ff2be,RSA0067887,133,"Erika M. Gardner; Millie Alba, Phillip Alba, Preston Alba",,,flowers,,Native,,,,"Pinus monophylla, Ephedra, Artemisia tridentata and Quercus chrysolepis",RSA accession #: 834394,,2013-04-20,2013-04-20,2013,04,20,,110,,2013,4,20,,"Exposed, compacted soil, granitic bench, near dry wash. Southwest facing slope.",,United States,,California,Kern,,"Trail to Yellow Jacket Spring, from the Pacific Crest Trail.; Horse Canyon 7.5'",5999ft.,35.586855,-118.129868,,,,206144,Syntrichopappus fremontii,Asteraceae,Syntrichopappus,,fremontii,,Species,A. Gray,2010,110
2422460071,1632045,https://cch2.org/portal/collections/individual/index.php?occid=1632045,YES,,3818c5b4-b6a4-11e8-b408-001a64db2964,,UCR,PreservedSpecimen,,UCR-BPS-214043,,37962,"A.C. Sanders; Stephen Reynolds, Anuja Parikh, Nathan Gale",,,Flowering,,,,,,,UCR-214043,,2010-04-20,2010-04-20,2010,04,20,,110,,2010,4,20,2010-4-20,Rounded hills and large gravelly wash; decomposed granite soil; oak woodland (sparse) and grassland with many annuals.,,United States,,California,Los Angeles,,"Crane Canyon, 1.0 mi. SE (144°) of Castac Lake, 1.7 mi. NE (43°) of Gorman, just S of Kern Co. line",,34.81389,-118.83194,,,,206144,Syntrichopappus fremontii,Asteraceae,Syntrichopappus,,fremontii,,Species,A. Gray,2010,110
2422428103,1594985,https://cch2.org/portal/collections/individual/index.php?occid=1594985,YES,,3818c5b4-b6a4-11e8-b408-001a64db2964,,UCR,PreservedSpecimen,,UCR-BPS-175264,,7377,Jim André; Tasha LaDoux,,,Flowering,,,,,,,UCR-175264,,2006-04-20,2006-04-20,2006,04,20,,110,,2006,4,20,2006-4-20,"Sandy bench in post-fire Joshua Tree woodland, with Yucca brevifolia, Verbena gooddinggii, Pectocarya platycarpa, Eriophyllum wallacei.",,United States,,California,San Bernardino,,Mid Hills: just west of Wildhorse Canyon Rd and c. 3 miles NW of Hole-In-The-Wall,,35.05583,-115.44003,,,,206144,Syntrichopappus fremontii,Asteraceae,Syntrichopappus,,fremontii,,Species,A. Gray,2000,110
3125171911,459295,https://cch2.org/portal/collections/individual/index.php?occid=459295,YES,,0945030a-f625-4b95-9f48-e5cb7d6eb879,,SD,PreservedSpecimen,,F2EADF53-DFBA-4461-A8F7-5751C5436D19,,9280,James R. Shevock,,,FL,,,,,,On annual grassland with scattered shrubs. Area recently burned.,SD231078,,1982-04-21,1982-04-21,1982,04,21,,111,,1982,4,21,"Apr 21, 1982",On metamorphic soils and boulders.,,United States,,California,Kern,,"Western slope of the Southern Sierra Nevada. Kern Plateau, Kern River Basin. Along Sierra Way overlooking Lake Isabella, 8.3 miles northwesr of California Highway 178.",,35.68056,-118.41667,WGS84,,,206144,Syntrichopappus fremontii,Asteraceae,Syntrichopappus,,fremontii,,Species,A. Gray,1980,111
3010181304,4418323,https://cch2.org/portal/collections/individual/index.php?occid=4418323,YES,,3818d95b-b6a4-11e8-b408-001a64db2964,,OBI,PreservedSpecimen,,b23be15d-f36a-4a0c-9fa8-7bbda8483652,OBI158663,17671,Arnold Tiehm; Jan Nachlinger,,,,,,,,,Gutierrezia microcephala,,,2017-04-21,2017-04-21,2017,04,21,,111,,2017,4,21,,Red clay flats.,,United States,,Nevada,Lincoln,,"Tule Springs Hills, 1.4 road miles SSW of Snow Spring on road to Jones Spring.",3400 ft.; 3400ft.,37.1625,-114.137483,NAD83,,T9S R70E S11,206144,Syntrichopappus fremontii,Asteraceae,Syntrichopappus,,fremontii,,Species,A. Gray,2010,111
2989918996,4129363,https://cch2.org/portal/collections/individual/index.php?occid=4129363,YES,,3818e1d3-b6a4-11e8-b408-001a64db2964,,RSA,PreservedSpecimen,,ec03ec33-c974-492e-9eb5-e6aeef1232fd,,9280,J. R. Shevock,,,flowers,,Native,,,,,RSA accession #: 789964,,1982-04-21,1982-04-21,1982,04,21,,111,,1982,4,21,,On metamorphic soils and boulders on annual grassland with scattered shrubs. Area recently burned.,,United States,,California,Kern,,"Kern Plateau, Kern River Basin. Along Sierra Way overlooking Lake Isabella, 8.3 miles northwest of California highway 178.",3000ft.,35.6805556,-118.4166667,,,T26S R33E S10,206144,Syntrichopappus fremontii,Asteraceae,Syntrichopappus,,fremontii,,Species,A. Gray,1980,111
2610101707,3894923,https://cch2.org/portal/collections/individual/index.php?occid=3894923,YES,,3818e1d3-b6a4-11e8-b408-001a64db2964,,RSA,PreservedSpecimen,,c3be170c-b0ea-4cd2-9afa-396d56b51ccf,RSA0161837,17671,Arnold Tiehm; Jan Nachlinger,,,,,,,,,Gutierrezia microcephala,RSA accession #: 877845,,2017-04-21,2017-04-21,2017,04,21,,111,,2017,4,21,,Red clay flats.,,United States,,Nevada,Lincoln,,"Tule Springs Hills, 1.4 road miles SSW of Snow Spring on road to Jones Spring.",3400 ft.; 3400ft.,37.1625,-114.137483,NAD83,,T9S R70E S11,206144,Syntrichopappus fremontii,Asteraceae,Syntrichopappus,,fremontii,,Species,A. Gray,2010,111
2430517217,915842,https://cch2.org/portal/collections/individual/index.php?occid=915842,YES,,3818e1d3-b6a4-11e8-b408-001a64db2964,,RSA,PreservedSpecimen,,60732439-d78e-4400-936e-0f0c0af12b0e,,9280,J. R. Shevock,,,,,Native,,,,,RSA accession #: 788505,,1982-04-21,1982-04-21,1982,04,21,,111,,1982,4,21,,On metamorphic soils and boulders on annual grassland with scattered shrubs. Area recently burned.,,United States,,California,Kern,,"Kern Plateau, Kern River Basin. Along Sierra Way overlooking Lake Isabella, 8.3 miles northwest of California highway 178.",3000ft.,35.6805556,-118.4166667,,,T26S R33E S10,206144,Syntrichopappus fremontii,Asteraceae,Syntrichopappus,,fremontii,,Species,A. Gray,1980,111
2430358094,669287,https://cch2.org/portal/collections/individual/index.php?occid=669287,YES,,3818e1d3-b6a4-11e8-b408-001a64db2964,,RSA,PreservedSpecimen,,0f04a643-9667-4451-b877-894e34c488a8,,8399,Scott D. White,,,flowers & fruits,,Native,,,,,RSA accession #: 674698,,2001-04-21,2001-04-21,2001,04,21,,111,,2001,4,21,,Degraded creosote bush shrubland. Larrea tridentata is the overwhelmingly dominant shrub; herb cover heavily dominated by Erodium cicutarium. Much sign of sheep grazing and off-road vehicle use.,,United States,,California,San Bernardino,,Southwest Mojave Desert: Apple Valley. Bajada surface just west of Bell Mountain; Apple Valley North,2900-3100ft.,34.5833333,-117.2166667,,,T6N R3W S28,206144,Syntrichopappus fremontii,Asteraceae,Syntrichopappus,,fremontii,,Species,A. Gray,2000,111
2430303926,1224853,https://cch2.org/portal/collections/individual/index.php?occid=1224853,YES,,3818e1d3-b6a4-11e8-b408-001a64db2964,,RSA,PreservedSpecimen,,f3efad18-f2bc-41e4-a0a6-77a342ceb84c,RSA0060924,11433,J. R. Shevock; Barbara Ertter,,,flowers,,Native,,,,,RSA accession #: 790204,,1986-04-21,1986-04-21,1986,04,21,,111,,1986,4,21,,On sandy soil in a Joshua tree woodland with creosote bush.,,United States,,California,Kern,,BLM-California Desert Conservation Area. About 3 miles NW of Red Rock Canyon State Park west of the L.A. Aqueduct Road.,3280ft.,35.4333333,-118.0125,,,T29S R37E S9,206144,Syntrichopappus fremontii,Asteraceae,Syntrichopappus,,fremontii,,Species,A. Gray,1980,111
2430187040,1159637,https://cch2.org/portal/collections/individual/index.php?occid=1159637,NO,,3818e1d3-b6a4-11e8-b408-001a64db2964,,RSA,PreservedSpecimen,,d4afd62a-8109-457e-a172-c48da0171027,RSA0073269,2074,Orlando Mistretta; Christine Mistretta,,,,,,,,,"Juniperus californica, Prunus fasciculata, Salvia dorrii var. dorrii, Ericameria linearifolia, Stipa speciosa, Poa secunda, Erogonum fasciculatum var. polifolium, Yucca brevifolia, numerous annuals",RSA accession #: 836968,,2005-04-21,2005-04-21,2005,04,21,,111,,2005,4,21,,"Juniper woodland; coarse granitic soils, slight North exposure.",,United States,,California,Los Angeles,,"Transverse Ranges; San Gabriel Mountains region: Big Pines Highway, 2.85 miles SE of Valyermo Ranger Station.",4400ft.,34.43027,-117.81692,,,,206144,Syntrichopappus fremontii,Asteraceae,Syntrichopappus,,fremontii,,Species,A. Gray,2000,111
2430078755,1049897,https://cch2.org/portal/collections/individual/index.php?occid=1049897,YES,,3818e1d3-b6a4-11e8-b408-001a64db2964,,RSA,PreservedSpecimen,,a0362c1e-de5a-4832-b022-4b911ab6199b,,10196,Scott D. White; Michael Honer,,,flowers,,Native,,,,,RSA accession #: 702767,,2004-04-20,2004-04-20,2004,04,20,,111,,2004,4,20,,Open desert shrubland.,,United States,,California,San Bernardino,,"Oro Grande area. Victorville Industrial Minerals, proposed new mining / operations area east of ""Klondike Mine.""; Victorville",2800-3200ft.,34.5923611,-117.2941944,,,T6N R4W S16,206144,Syntrichopappus fremontii,Asteraceae,Syntrichopappus,,fremontii,,Species,A. Gray,2000,111
2422537056,3600549,https://cch2.org/portal/collections/individual/index.php?occid=3600549,YES,,3818c5b4-b6a4-11e8-b408-001a64db2964,,UCR,PreservedSpecimen,,UCR-BPS-287845,,17671,Arnold Tiehm; Jan Nachlinger,,,Flowering,,,,,,,UCR-287845,,2017-04-21,2017-04-21,2017,04,21,,111,,2017,4,21,2017-4-21,"Red clay flats, with Gutierrezia microcephala.",,United States,,Nevada,Lincoln,,"Tule Springs Hills, 1.4 road miles south-southwest of Snow Spring on road to Jones Spring",,37.1625,-114.13747,,,T9S R70E sec11,206144,Syntrichopappus fremontii,Asteraceae,Syntrichopappus,,fremontii,,Species,A. Gray,2010,111
2422495206,1671294,https://cch2.org/portal/collections/individual/index.php?occid=1671294,YES,,3818c5b4-b6a4-11e8-b408-001a64db2964,,UCR,PreservedSpecimen,,UCR-BPS-253962,,10468A,Mitch Provance; Callen Huff,,,Flowering,,,,,,,UCR-253962,,2009-04-21,2009-04-21,2009,04,21,,111,,2009,4,21,2009-4-21,"Dry gentle slopes with Lotus procumbens, Mirabilis laevis, Eriogonum fasciculatum, E. wrightii, Juniperus californica.",,United States,,California,Kern,,"Canyon del Gato Montes, north of Neenach, dirt track east of 270th St., c. 5.5 miles north of Los Angeles Co. line",,34.89942,-118.60789,,,,206144,Syntrichopappus fremontii,Asteraceae,Syntrichopappus,,fremontii,,Species,A. Gray,2000,111
2422476413,1651409,https://cch2.org/portal/collections/individual/index.php?occid=1651409,YES,,3818c5b4-b6a4-11e8-b408-001a64db2964,,UCR,PreservedSpecimen,,UCR-BPS-228211,,7944,Dave Silverman; Cindy Hopkins,,,Flowering & Fruiting,,,,,,,UCR-228211,,2010-04-21,2010-04-21,2010,04,21,,111,,2010,4,21,2010-4-21,"Creosote bush scrub with Larrea tridentata, Ambrosia dumosa, Dichelostemma pulchellum, Guillenia lasiophylla, Chaenactis fremontii, C. stevioides, Malacothrix coulteri, Camissonia palmeri, Mentzelia albicaulis, Pectocarya linearis, Eriogonum clavatum, E. gracillimum, Lasthenia gracilis, Chrorizanthe watsoni, and C. brevicornu.",,United States,,California,Kern,,"Indian Wells Valley, 680 m W of Hwy 395, 3.9 km NW of Hwy 395/Brown Rd jct, 9.9 km SE of Inyokern & 15.5 km E of I-14",,35.57683,-117.74422,,,11s 0432568E 3937269N,206144,Syntrichopappus fremontii,Asteraceae,Syntrichopappus,,fremontii,,Species,A. Gray,2010,111
2422398316,1561438,https://cch2.org/portal/collections/individual/index.php?occid=1561438,YES,,3818c5b4-b6a4-11e8-b408-001a64db2964,,UCR,PreservedSpecimen,,UCR-BPS-141165,,s.n.,June Latting,,,Flowering,,,,,,,UCR-141165,,1973-04-21,1973-04-21,1973,04,21,,111,,1973,4,21,1973-4-21,,,United States,,California,Los Angeles,,"near Hi Vista, vicinity of Ave G at 200th St. East, Antelope Valley",,34.735,-117.775,,,,206144,Syntrichopappus fremontii,Asteraceae,Syntrichopappus,,fremontii,,Species,A. Gray,1970,111
2422303986,1465826,https://cch2.org/portal/collections/individual/index.php?occid=1465826,YES,,3818c5b4-b6a4-11e8-b408-001a64db2964,,UCR,PreservedSpecimen,,UCR-BPS-96303,,2696,B.G. Pitzer,,,Flowering & Fruiting,,,,,,,UCR-96303,,1996-04-20,1996-04-20,1996,04,20,,111,,1996,4,20,1996-4-20,"Small gravel wash in previously plowed agricultural fields. Many annuals and perennials, but few shrubs. Assoc. w/ Eschscholzia californica, Lupinus excubitus, Bromus rubens, etc.",,United States,,California,Los Angeles,,"Antelope Valley, north side of Hwy 138 (Ave. D), c. 2 miles west of Neenach, c. 30 miles west of Hwy 14; Western Mojave Desert",,34.78567,-118.63333,,,11S 5E 5N,206144,Syntrichopappus fremontii,Asteraceae,Syntrichopappus,,fremontii,,Species,A. Gray,1990,111
2422280031,1441184,https://cch2.org/portal/collections/individual/index.php?occid=1441184,YES,,3818c5b4-b6a4-11e8-b408-001a64db2964,,UCR,PreservedSpecimen,,UCR-BPS-7757,,s.n.,Dennis Vander Ven,,,Flowering,,,,,,,UCR-7757,,1968-04-20,1968-04-20,1968,04,20,,111,,1968,4,20,1968-4-20,"Pinyon-Juniper and Joshua tree woodland, sandy-gravelly soil",,United States,,California,San Bernardino,,"5 miles above Rimrock [on Burns Canyon Rd.], right at red cabin to left, 2.3 miles to Mitchells cabin, the last one",,34.21389,-116.58139,,,,206144,Syntrichopappus fremontii,Asteraceae,Syntrichopappus,,fremontii,,Species,A. Gray,1960,111
2422279841,1441189,https://cch2.org/portal/collections/individual/index.php?occid=1441189,YES,,3818c5b4-b6a4-11e8-b408-001a64db2964,,UCR,PreservedSpecimen,,UCR-BPS-15370,,s.n.,George K. Helmkamp,,,Flowering,,,,,,,UCR-15370,,1977-04-21,1977-04-21,1977,04,21,,111,,1977,4,21,1977-4-21,Dry sandy wash with creosote bush scrub.,,United States,,California,San Bernardino,,"Hwy 395 at north base of Red Mountain, near Johannesburg",,35.36417,-117.61583,,,,206144,Syntrichopappus fremontii,Asteraceae,Syntrichopappus,,fremontii,,Species,A. Gray,1970,111
2270518341,19455211,https://swbiodiversity.org/seinet/collections/individual/index.php?occid=19455211,YES,,a2e32c87-d320-4a01-bafd-a9182ae2e191,,ASU,PreservedSpecimen,,9ea32716-28b9-4dca-a813-bf464598e0f1,ASU0108339,17671,Arnold Tiehm; Jan Nachlinger,,,,,,,,,,,,2017-04-21,2017-04-21,2017,04,21,,,,,,,2017-4-21,"Red clay flats, with Gutierrezia microcephala.",,United States,,Nevada,Lincoln,,"Tule Springs Hills, 1.4 road miles south-southwest of Snow Spring on road to Jones Spring",,37.1625,-114.13747,,,T9S R70E sec11,2187,Syntrichopappus fremontii,Asteraceae,Syntrichopappus,,fremontii,,Species,A. Gray,2010,111
1986916641,21088848,https://intermountainbiota.org/portal/collections/individual/index.php?occid=21088848,YES,http://grbio.org/institution/utah-state-university,06bf658d-f555-4c9c-ab93-fc2d7db7086e,,Utah State University,PreservedSpecimen,,97e67d14-b4e6-4aa8-830d-a3f8b099ed2d,UTC00281997,17671,A. Tiehm; J. Nachlinger,,,Flower,,,,,,Gutierrezia microcephala,,,2017-04-21,2017-04-21,2017,04,21,,111,,2017,4,21,21 April 2017,Red clay flats,,United States,,Nevada,Lincoln,,"Tule Springs Hills, 1.4 road miles SSW of Snow Spring on road to Jones Spring",3400 ft.,37.1625,-114.137483,NAD83,,TRS: T9S R70E sec 11; 37° 09.750' N 114° 08.249' W,2187,Syntrichopappus fremontii,Asteraceae,Syntrichopappus,,fremontii,,Species,A. Gray,2010,111
1927874562,078d487c-ea60-4500-92a8-f34f0a86f526,http://sweetgum.nybg.org/science/vh/specimen_details.php?irn=3919453,YES,http://biocol.org/urn:lsid:biocol.org:col:15556,http://biocol.org/urn:lsid:biocol.org:col:15556,,NY,PreservedSpecimen,,078d487c-ea60-4500-92a8-f34f0a86f526,03595153,17671,A. Tiehm,,,,,,,,,,,,2017-04-21,2017-04-21,2017,04,21,,11,11,2017,4,21,21 Apr 2017,,,United States of America,,Nevada,Lincoln Co.,,"Tule Springs Hills, 1.4 road miles SSW of Snow Spring on road to Jones Spring.",3400 ft,37.1625,-114.13747,,,,,Syntrichopappus fremontii A.Gray,Asteraceae,Syntrichopappus,,fremontii,,Species,A.Gray,2010,111
