gbifID,identifier,references,VF,institutionID,collectionID,datasetID,institutionCode,basisOfRecord,informationWithheld,occurrenceID,catalogNumber,recordNumber,recordedBy,sex,lifeStage,reproductiveCondition,behavior,establishmentMeans,occurrenceStatus,associatedMedia,associatedReferences,associatedTaxa,otherCatalogNumbers,organismID,eventDate,Date_2,Year_2,Month_2,Day_2,eventTime,startDayOfYear,endDayOfYear,year,month,day,verbatimEventDate,habitat,fieldNotes,country,countryCode,stateProvince,county,municipality,locality,verbatimElevation,decimalLatitude,decimalLongitude,geodeticDatum,coordinateUncertaintyInMeters,verbatimCoordinates,taxonID,scientificName,family,genus,subgenus,specificEpithet,infraspecificEpithet,taxonRank,scientificNameAuthorship,Decade,DOY
2430256739,1188628,https://cch2.org/portal/collections/individual/index.php?occid=1188628,YES,,3818e1d3-b6a4-11e8-b408-001a64db2964,,RSA,PreservedSpecimen,,e2a35aba-6869-4640-a9d7-84bd83f813c1,,6987,A. C. Sanders,,,flowers,,Native,,,,,RSA accession #: 381549,,1987-04-04,1987-04-04,1987,04,04,,94,,1987,4,4,,"Rocky slopes, mostly rhyolite, with joshua tree woodland and other desert scrub",,United States,,California,San Bernardino,,"Hart Mine, Sw end of the Castle Mtns, E Mojave Desert, S24 (except where noted); Castle Peak",4500ft.,35.286389,-115.105,WGS84,1200,,206144,Syntrichopappus fremontii,Asteraceae,Syntrichopappus,,fremontii,,Species,A. Gray,1980,94
2422469652,1643938,https://cch2.org/portal/collections/individual/index.php?occid=1643938,YES,,3818c5b4-b6a4-11e8-b408-001a64db2964,,UCR,PreservedSpecimen,,UCR-BPS-226203,,16719,"Jim André; Art Riggs, Jane Riggs",,,Flowering,,,,,,,UCR-226203,,2011-04-04,2011-04-04,2011,04,04,,94,,2011,4,4,2011-4-4,"Bouldery pinyon-juniper woodland with Pinus monophylla, Juniperus osteosperma, Ericameria linearifolia, Stipa speciosa.",,United States,,California,San Bernardino,,"Granite Mountains, UC Granite Mountains Desert Research Center, along Allanson Trail to high plateau, at second ridge along trail",,34.78595,-115.67445,,,,206144,Syntrichopappus fremontii,Asteraceae,Syntrichopappus,,fremontii,,Species,A. Gray,2010,94
2422295989,1454398,https://cch2.org/portal/collections/individual/index.php?occid=1454398,YES,,3818c5b4-b6a4-11e8-b408-001a64db2964,,UCR,PreservedSpecimen,,UCR-BPS-47344,,6987,A.C. Sanders,,,Flowering,,,,,,,UCR-47344,,1987-04-04,1987-04-04,1987,04,04,,94,,1987,4,4,1987-4-4,"Rocky slopes, mostly rhyolite, w/ Joshua tree woodland and other desert scrub; w/ Yucca baccata, Y. schidigera, Y. brevifolia, Larrea tridentata, Opuntia acanthicarpa, Hilaria jamesii, Salazaria mexicana, Coleogyne ramosissima, etc.",,United States,,California,San Bernardino,,"Hart Mine, SW end of Castle Mountains; Eastern Mojave Desert",,35.28639,-115.105,,,11S 7E 0N; T14N R17E sec24,206144,Syntrichopappus fremontii,Asteraceae,Syntrichopappus,,fremontii,,Species,A. Gray,1980,94
2422279974,1441186,https://cch2.org/portal/collections/individual/index.php?occid=1441186,YES,,3818c5b4-b6a4-11e8-b408-001a64db2964,,UCR,PreservedSpecimen,,UCR-BPS-33171,,16667,James Henrickson,,,Flowering,,,,,,,UCR-33171,,1978-04-04,1978-04-04,1978,04,04,,94,,1978,4,4,1978-4-4,"On rocky flats w/ Atriplex, Grayia, Larrea, Eriogonum fasciculatum, Lycium, Thamnosma, etc.",,United States,,California,San Bernardino,,"c. 20.5 miles NW of Barstow, c. 1.5 miles west of Opal Mtn.",,35.17222,-117.20861,,,,206144,Syntrichopappus fremontii,Asteraceae,Syntrichopappus,,fremontii,,Species,A. Gray,1970,94
3091228439,2118293,https://swbiodiversity.org/seinet/collections/individual/index.php?occid=2118293,YES,,17a53c97-835b-409e-8a9a-c9a7307a4965,,ASC,PreservedSpecimen,,f5aa997e-8906-468c-a825-263932703248,ASC00094534,6,P. Koestner,,,,,,,,,"Atriplex, Juniperus monosperma, Krascheninnikovia",,,2008-04-04,2008-04-04,2008,04,04,,95,,2008,4,4,,Mojave desert scrub; near creek,,United States,,Arizona,Mohave,,"Black Mountains, 2 mi S of Mt. Perkins",5080ft.,35.54243,-114.50626,,,,2187,Syntrichopappus fremontii,Asteraceae,Syntrichopappus,,fremontii,,Species,A. Gray,2000,95
3091218876,2118092,https://swbiodiversity.org/seinet/collections/individual/index.php?occid=2118092,YES,,17a53c97-835b-409e-8a9a-c9a7307a4965,,ASC,PreservedSpecimen,,82cdd364-750d-4405-b013-a0ea06f50939,ASC00094685,1,T. Stefanova,,,,,,,,,"Juniperus californica, Eriogonum fasciculatum, Coleogyne ramosissima, Salazaria mexicana, Peucephyllum schottii, Encelia",,,2008-04-04,2008-04-04,2008,04,04,,95,,2008,4,4,,SE facing rocky slope in open areas,,United States,,Arizona,Mohave,,"Black Mountains, 2 mi S of Mount Perkins",4380ft.,35.53461,-114.50362,,,,2187,Syntrichopappus fremontii,Asteraceae,Syntrichopappus,,fremontii,,Species,A. Gray,2000,95
2430215336,643065,https://cch2.org/portal/collections/individual/index.php?occid=643065,YES,,3818e1d3-b6a4-11e8-b408-001a64db2964,,RSA,PreservedSpecimen,,028f7404-5dae-4769-bf5e-4ff471dd2f50,RSA0019442,4715,Duncan S. Bell,,,flowers,,Native,,,,,RSA accession #: 807323,,2013-04-05,2013-04-05,2013,04,05,,95,,2013,4,5,,"A narrow canyon with Lycium cooperi, Larrea tridentata, Sphaeralcea ambigua, Salazaria mexicana, Lepidium fremontii, Krameria, Ephedra, Opuntia basilaris, Amsinckia tessellata, Bromus rubens, Phacelia distans, Phacelia crenulata, ect.",,United States,,California,San Bernardino,,"BLMCollecting in Owl Canyon to the east of Rainbow Basin, approximately 10 air miles north of Barstow.; Mud Hills",3396ft.,35.03889,-117.02448,NAD83,,T11N R1W S18,206144,Syntrichopappus fremontii,Asteraceae,Syntrichopappus,,fremontii,,Species,A. Gray,2010,95
2430095287,1066850,https://cch2.org/portal/collections/individual/index.php?occid=1066850,YES,,3818e1d3-b6a4-11e8-b408-001a64db2964,,RSA,PreservedSpecimen,,a857f9a8-1350-4e85-8334-d18b46f33571,,1597,Orlando Mistretta,,,flowers & fruits,,Native,,,,,RSA accession #: 587402,,1995-04-05,1995-04-05,1995,04,05,,95,,1995,4,5,,Pinyon-Juniper Woodland.,,United States,,California,Los Angeles,,"San Gabriel Mtns, drainage W of Little Rock Creek Reservoir.; Pacifico Mtn 7.5'",3400ft.,34.477409,-118.036283,,969,T5N R11W S33,206144,Syntrichopappus fremontii,Asteraceae,Syntrichopappus,,fremontii,,Species,A. Gray,1990,95
2430070149,1041420,https://cch2.org/portal/collections/individual/index.php?occid=1041420,YES,,3818e1d3-b6a4-11e8-b408-001a64db2964,,RSA,PreservedSpecimen,,9c4290f4-4954-4876-860e-4825f7c0a58f,,6081,Timothy S. Ross,,,flowers,,Native,,,,,RSA accession #: 549551,,1992-04-04,1992-04-04,1992,04,04,,95,,1992,4,4,,Mapped as Mesozoic granitic rocks.,,United States,,California,Los Angeles,,Adobe Mountain: SW Mojave Desert.; Adobe Mtn. 7.5',3040-3458ft.,34.697588,-117.67587,,969,T7N R8W S13,206144,Syntrichopappus fremontii,Asteraceae,Syntrichopappus,,fremontii,,Species,A. Gray,1990,95
2422375322,1537371,https://cch2.org/portal/collections/individual/index.php?occid=1537371,YES,,3818c5b4-b6a4-11e8-b408-001a64db2964,,UCR,PreservedSpecimen,,UCR-BPS-126133,,25884,A.C. Sanders; Mark Elvin,,,Flowering,,,,,,,UCR-126133,,2003-04-05,2003-04-05,2003,04,05,,95,,2003,4,5,2003-4-5,"Flats and bouldery granitic hills, decomposed granite soil; pinyon-juniper woodland with Juniperus, Pinus monophylla, Quercus cornelius-mulleri, Eriogonum fasciculatum, Yucca schidigera, etc.",,United States,,California,San Bernardino,,"UC Burns Pinyon Ridge Reserve, off Skyline Ranch Rd. c. 2 miles (air) ESE of Pioneertown, 1.5 miles (air) NW of Yucca Valley, between front gate and reserve headquarters at old Burns home",,34.14917,-116.45583,,,T1N R5E sec27 NW/4,206144,Syntrichopappus fremontii,Asteraceae,Syntrichopappus,,fremontii,,Species,A. Gray,2000,95
2270565904,3286817,https://swbiodiversity.org/seinet/collections/individual/index.php?occid=3286817,YES,,a2e32c87-d320-4a01-bafd-a9182ae2e191,,ASU,PreservedSpecimen,,977a4705-8f7d-44a9-b310-7c938d500a5c,,1,T. Stefanova,,,,,,,,,"Juniperus californica, Eriogonum fasciculatum, Coleogyne ramosissima, Salazaria mexicana, Peucephyllum schottii, Encelia",287088,,2008-04-04,2008-04-04,2008,04,04,,95,,,,,,SE facing rocky slope in open areas,,USA,,ARIZONA,Mohave County,,"Black Mountains, 2 mi S of Mount Perkins",4380ft.,35.53461,-114.50362,,,,2187,Syntrichopappus fremontii,Asteraceae,Syntrichopappus,,fremontii,,Species,A. Gray,2000,95
2236237094,22130561,https://www.inaturalist.org/observations/22130561,YES,,,,iNaturalist,HumanObservation,,https://www.inaturalist.org/observations/22130561,22130561,,Merav Vonshak,,,,,wild,,,,,,,2019-04-05T10:35:17-07:00,2019-04-05,2019,04,05,17:35:17Z,,,,,,Fri Apr 05 2019 10:35:17 GMT-0700 (PDT),,,,US,Nevada,,,,,36.89656167,-116.829095,EPSG:4326,6,,79308,Syntrichopappus fremontii,Asteraceae,Syntrichopappus,,,,species,,2010,95
3125045871,459286,https://cch2.org/portal/collections/individual/index.php?occid=459286,YES,,0945030a-f625-4b95-9f48-e5cb7d6eb879,,SD,PreservedSpecimen,,D9ED7C7C-A260-4D16-9D77-C7632B213507,,4819,Rimo Bacigalupi,,,FL,,,,,,,SD58385,,1955-04-06,1955-04-06,1955,04,06,,96,,1955,4,6,"Apr 06, 1955",,,United States,,California,San Bernardino,,"3.3 miles south of Atolia, Mohave Desert.",unknownft.,35.2535,-117.612,WGS84,,,206144,Syntrichopappus fremontii,Asteraceae,Syntrichopappus,,fremontii,,Species,A. Gray,1950,96
2422475183,1648577,https://cch2.org/portal/collections/individual/index.php?occid=1648577,YES,,3818c5b4-b6a4-11e8-b408-001a64db2964,,UCR,PreservedSpecimen,,UCR-BPS-232117,,18776,Jim André,,,Flowering,,,,,,,UCR-232117,,2011-04-06,2011-04-06,2011,04,06,,96,,2011,4,6,2011-4-6,"North-facing limestone slopes, with Ambrosia dumosa, Yucca brevifolia, Coleogyne ramosissima, Atriplex canescens.",,United States,,California,San Bernardino,,"along powerline road, 15.7 mi east of Hwy 127 at Silver Lake, north end of Squaw Mountain, northeast of Turquoise Mountain and west of Clark Range",,35.49837,-115.90423,,,,206144,Syntrichopappus fremontii,Asteraceae,Syntrichopappus,,fremontii,,Species,A. Gray,2010,96
2430102974,1073530,https://cch2.org/portal/collections/individual/index.php?occid=1073530,YES,,3818e1d3-b6a4-11e8-b408-001a64db2964,,RSA,PreservedSpecimen,,ab8eb207-31ee-4e09-91e6-d9858719115c,RSA0047690,27834,Jim André,,,flowers,,Native,,,,"Larrea tridentata, Yucca brevifolia, Ambrosia dumosa, Mentzelia nitens, Grayia spinosa, Amsinckia vernicosa, Poa secunda",RSA accession #: 825360,,2014-04-07,2014-04-07,2014,04,07,,97,,2014,4,7,,"base of hills, reddish volcanic sandy clay",,United States,,California,San Bernardino,,"BLMWest side of Mud Hills along Copper City Rd, approx 3 mi. NW of Irwin Rd, approx. 10 mi. north of Barstow.; Lane Mountain 7.5'",3337ft.,35.0401333,-116.9737667,NAD83,,,206144,Syntrichopappus fremontii,Asteraceae,Syntrichopappus,,fremontii,,Species,A. Gray,2010,97
2423122165,32922186,https://www.inaturalist.org/observations/32922186,YES,,,,iNaturalist,HumanObservation,,https://www.inaturalist.org/observations/32922186,32922186,,Matt Berger,,,,,wild,,,,,,,2019-04-07T18:08:00-10:00,2019-04-07,2019,04,07,04:08:00Z,,,,,,2019/04/07 6:08 PM HST,,,,US,California,,,,,36.59709444,-118.0970389,EPSG:4326,5,,79308,Syntrichopappus fremontii,Asteraceae,Syntrichopappus,,,,species,,2010,97
2236250882,22180299,https://www.inaturalist.org/observations/22180299,YES,,,,iNaturalist,HumanObservation,,https://www.inaturalist.org/observations/22180299,22180299,,Kristen,,,,,wild,,,,,,,2019-04-07T09:53:46-07:00,2019-04-07,2019,04,07,16:53:46Z,,,,,,2019-04-07 9:53:46 AM PDT,,,,US,California,,,,,36.61099486,-118.1238091,EPSG:4326,132,,79308,Syntrichopappus fremontii,Asteraceae,Syntrichopappus,,,,species,,2010,97
2422477897,1652337,https://cch2.org/portal/collections/individual/index.php?occid=1652337,YES,,3818c5b4-b6a4-11e8-b408-001a64db2964,,UCR,PreservedSpecimen,,UCR-BPS-234931,,17489,Jim André,,,Flowering,,,,,,,UCR-234931,,2009-04-08,2009-04-08,2009,04,08,,98,,2009,4,8,2009-4-8,"Moist wash with Phacelia pachyphylla, Ambrosia salsola Stanleya pinnata, Polypogon monspeliensis.",,United States,,California,San Bernardino,,"southwest end of Clipper Mountains, along dirt road to Bonanza Mine and Spring, 2.2 mi north of US Route 66 (National Trails Hwy) at Danby",,34.6717,-115.39515,,,,206144,Syntrichopappus fremontii,Asteraceae,Syntrichopappus,,fremontii,,Species,A. Gray,2000,98
2422294631,1457012,https://cch2.org/portal/collections/individual/index.php?occid=1457012,YES,,3818c5b4-b6a4-11e8-b408-001a64db2964,,UCR,PreservedSpecimen,,UCR-BPS-77223,,722,D.R. Schramm; J.S. Holland,,,Flowering,,,,,,,UCR-77223,,1978-04-08,1978-04-08,1978,04,08,,98,,1978,4,8,1978-4-8,with Larrea and Menodora spinescens,,United States,,California,Inyo,,"Death Valley National Monument. 4 mi west of Greenwater Valley road, on road to Furnace; central Black Mountains; North Mojave Desert region",,35.99325,-116.43144,,,,206144,Syntrichopappus fremontii,Asteraceae,Syntrichopappus,,fremontii,,Species,A. Gray,1970,98
2418049801,2149195,https://cch2.org/portal/collections/individual/index.php?occid=2149195,YES,,6a942843-3cb1-4643-a475-24df2d2ba49f,,CHSC,PreservedSpecimen,,665f9400-5f70-425c-8862-40c3be2b8278,CHSC101476,1697,B. Castro; L. P. Janeway,,,,,,,,,,,,2008-04-07,2008-04-07,2008,04,07,,98,,2008,4,7,04/07/2008,"On gentle NW-facing slope at base of Red Mountain in creosote scrub. Among gold carpets of Lasthenia gracilis, with scattered blue-dicks and annual Phacelia spp.",,United States,,California,San Bernardino,,"Mojave Desert. Ca 2 mi NE of Johannesburg, along Steam Well Road 0.2 km east of Trona Road, off SW edge of Golden Valley Wilderness Area. T29S R41E S29 SW1/4 of SE1/4 USGS Quadrangle: Klinker Mountain 1:24,000",3360ft.,35.383333,-117.604167,NAD 1983,,T29S R41E S29 SW1/4 of SE1/4; 35§ 23m N; 117§ 36m 15s W,206144,Syntrichopappus fremontii,Asteraceae,Syntrichopappus,,fremontii,,Species,A. Gray,2000,98
1846502534,2054874,https://swbiodiversity.org/seinet/collections/individual/index.php?occid=2054874,YES,,edb9860c-c481-4d19-88cc-224a536ebcd4,,DES,PreservedSpecimen,,b29c6ecb-0aae-4345-9f78-c047d36720ad,DES00024292,722,J. S. Holland; D.R. Schram,,,flower & fruit,,,,,,"Larrea, Menodora spinescens",,,1978-04-08,1978-04-08,1978,04,08,,98,,1978,4,8,,,,USA,,California,Inyo County,,"Death Valley National Monument. 4 miles West of Greenwater Valley Rd., on road to Furnace; Central Black Mts.",4100ft.,36.078309,-116.607611,,6761,,2187,Syntrichopappus fremontii,Asteraceae,Syntrichopappus,,fremontii,,Species,A. Gray,1970,98
3053351034,67305,https://cch2.org/portal/collections/individual/index.php?occid=67305,YES,,3818e0aa-b6a4-11e8-b408-001a64db2964,,SBBG,PreservedSpecimen,,45b8bfa5-a80f-4d7a-8a7c-8cccee53fb70,110139,15422,D. Wilken w/ E. Painter,,,Flowers Present,,,,,,Larrea,,,1998-04-09,1998-04-09,1998,04,09,,99,,1998,4,9,1998-4-9,"gravelly soil, W-facing bajada",,United States,,California,Inyo,," near Coso Hot Springs Rd, 7.3 km ENE of Coso Jct (Oasis), Coso Mtns",,36.0623,-117.8673,NAD27,200,,206144,Syntrichopappus fremontii,Asteraceae,Syntrichopappus,,fremontii,,Species,A. Gray,1990,99
1621774818,7241132,https://www.inaturalist.org/observations/7241132,YES,,,,iNaturalist,HumanObservation,,https://www.inaturalist.org/observations/7241132,7241132,,Matthew Salkiewicz,,,flowering,,wild,,,,,,,2017-04-09T13:27:09-07:00,2017-04-09,2017,04,09,20:27:09Z,,,,,,2017-04-09 13:27:09,,,,US,California,,,,,34.032532,-116.077209,EPSG:4326,220,,79308,Syntrichopappus fremontii,Asteraceae,Syntrichopappus,,,,species,,2010,99
1586104064,7256076,https://www.inaturalist.org/observations/7256076,YES,,,,iNaturalist,HumanObservation,,https://www.inaturalist.org/observations/7256076,7256076,,Matthew Salkiewicz,,,flowering,,wild,,,,,,,2017-04-09T14:21:26-07:00,2017-04-09,2017,04,09,21:21:26Z,,,,,,2017-04-09 14:21:26,,,,US,California,,,,,34.044908,-116.074033,EPSG:4326,220,,79308,Syntrichopappus fremontii,Asteraceae,Syntrichopappus,,,,species,,2010,99
3053471104,149099,https://cch2.org/portal/collections/individual/index.php?occid=149099,YES,,3818e0aa-b6a4-11e8-b408-001a64db2964,,SBBG,PreservedSpecimen,,eaf67ff5-3955-445b-afee-864b2e5c8854,15005,6796,Ernest C. Twisselmann,,,Flowers Present,,,,,,,,,1962-04-10,1962-04-10,1962,04,10,,100,,1962,4,10,1962-4-10,fractured slate; broad slope; creosote bush,,United States,,California,San Bernardino,,"Rand Mtns, ca. 4.4 mi S of the town of Red Mtn",4100 ft,35.3138,-117.6716,NAD83,500,,206144,Syntrichopappus fremontii,Asteraceae,Syntrichopappus,,fremontii,,Species,A. Gray,1960,100
2610076071,3798129,https://cch2.org/portal/collections/individual/index.php?occid=3798129,YES,,3818e1d3-b6a4-11e8-b408-001a64db2964,,RSA,PreservedSpecimen,,c8a1f53d-2423-4180-b47e-4e1598771d0f,RSA0135699,16036,R. G. Swinney,,,flowers,,Native,,,,"Dominants include Juniperus californica, Ephedra nevadensis, Salvia dorrii, Eriogonum fasciculatum, Ericameria linearifolia, Purshia glandulosa tridentata, also with Yucca brevifolia, Salvia columbariae, Malacothrix glabrata, Leptosyphon aureus, Eriophyllum pringlei Linanthus bigelovii, Gilia latifolia, Cryptantha pterocarya, Pectocarya setacea, Xylorhyza tortifolia, Encelia actoni, Amsinckia tessellata, and etc.",RSA accession #: 867434,,2014-04-10,2014-04-10,2014,04,10,,100,,2014,4,10,,"Sagebrush scrub, sandy loam with granitic, light-colored gravel.",,United States,,California,Los Angeles,,"San Gabriel Mountains. s.w. of Littlerock, n. margin of San Gabriel Mts. on desert slope, on s. side of Calif. Aqueduct and 100-400 m. east of Cheeseborro Rd.; Palmdale",2960-3020ft.,34.52667,-118.02528,,,,206144,Syntrichopappus fremontii,Asteraceae,Syntrichopappus,,fremontii,,Species,A. Gray,2010,100
2430352330,663538,https://cch2.org/portal/collections/individual/index.php?occid=663538,YES,,3818e1d3-b6a4-11e8-b408-001a64db2964,,RSA,PreservedSpecimen,,0c529360-44e8-41e6-8f02-d88745328761,RSA0046589,28374,Jim André,,,flowers,,Native,,,,"Larrea tridentata, Ambrosia dumosa, Encelia actoni, Psorothamnus arborescens, Phacelia tanacetifolia, Chaenactis fremontii, Chylismia brevipes",RSA accession #: 824532,,2014-04-10,2014-04-10,2014,04,10,,100,,2014,4,10,,"Rolling hills, exposed volcanic outcrops and gravelly alluvium.",,United States,,California,San Bernardino,,"BLMNewberry Mountains; west side of range along Camp Rock Rd, 8.3 mi. SSE of Jct with Interstate 40.; Minneola 7.5'",3571ft.,34.76255,-116.8232667,,,,206144,Syntrichopappus fremontii,Asteraceae,Syntrichopappus,,fremontii,,Species,A. Gray,2010,100
2430067466,1038373,https://cch2.org/portal/collections/individual/index.php?occid=1038373,YES,,3818e1d3-b6a4-11e8-b408-001a64db2964,,RSA,PreservedSpecimen,,9ac2fd22-3b43-4b9e-9821-10baa0780544,,354-B,J. D. Olmsted,,,flowers & fruits,,Native,,,,,RSA accession #: 783237,,1959-04-10,1959-04-10,1959,04,10,,100,,1959,4,10,,"Sandy soil, creosote desert",,United States,,California,San Bernardino,,Along roadside 10 miles SE of Lucerne Valley on road from Old Woman Springs to Yucca Valley; San Bernardino Mts,3100ft.,34.428721,-116.79427,WGS84,3500,,206144,Syntrichopappus fremontii,Asteraceae,Syntrichopappus,,fremontii,,Species,A. Gray,1950,100
2422519535,1695407,https://cch2.org/portal/collections/individual/index.php?occid=1695407,YES,,3818c5b4-b6a4-11e8-b408-001a64db2964,,UCR,PreservedSpecimen,,UCR-BPS-280542,,16036,R.G. Swinney,,,Flowering,,,,,,,UCR-280542,,2014-04-10,2014-04-10,2014,04,10,,100,,2014,4,10,2014-4-10,"Sagebrush scrub, sandy loam with granitic, light-colored gravel, dominants incl. Juniperus cal., Ephedra nev., Salvia dor., Eriogonum fas., Ericameria lin., Purshia g., also with Yucca br., Salvia col., Leptosiphon aur., Eriophyllum pri., Linanthus big., Gilia latifl., Cryptantha pt., Pectocarya set., Xylorhiza t., Encelia act., Amsinckia t.",,United States,,California,Los Angeles,,"SW of Littlerock, north foot of mountains on desert slope, south side of CA Aqueduct 100-400 m east of Cheseboro Rd.",,34.52667,-118.02528,,,T5N R11W sec16,206144,Syntrichopappus fremontii,Asteraceae,Syntrichopappus,,fremontii,,Species,A. Gray,2010,100
2418052354,2151132,https://cch2.org/portal/collections/individual/index.php?occid=2151132,YES,,6a942843-3cb1-4643-a475-24df2d2ba49f,,CHSC,PreservedSpecimen,,8ffb74e6-80ca-4861-8b1c-1b6e0a7b0b41,CHSC100743,9320,L. P. Janeway; B. Castro,,,,,,,,,,,,2008-04-10,2008-04-10,2008,04,10,,101,,2008,4,10,04/10/2008,"North-facing slope near top of small knob, red rocky soil. Heads with yellow rays.",,United States,,California,San Bernardino,,"Mojave Desert. South-southwestern slope of Opal Mountain, about 600 m from the top. T32S R45E S18 USGS Quadrangle: Opal Mountain 1:24,000",,35.154167,-117.188889,NAD 1983,,T32S R45E S18; 35§ 9m 15s N; 117§ 11m 20s W,206144,Syntrichopappus fremontii,Asteraceae,Syntrichopappus,,fremontii,,Species,A. Gray,2000,101
2430351941,768527,https://cch2.org/portal/collections/individual/index.php?occid=768527,YES,,3818e1d3-b6a4-11e8-b408-001a64db2964,,RSA,PreservedSpecimen,,3e123358-7fc7-4ec2-9850-87f9c5ca8cf2,,32467,R. F. Thorne,,,flowers,,Native,,,,,RSA accession #: 191607,,1963-04-12,1963-04-12,1963,04,12,,102,,1963,4,12,,sandy wash in desert,,United States,,California,San Bernardino,,"Ca. 20 miles SE of Old Woman Springs, SW edge Mojave Desert.",3700ft.,34.26023,-116.44093,NAD83,800,,206144,Syntrichopappus fremontii,Asteraceae,Syntrichopappus,,fremontii,,Species,A. Gray,1960,102
2430099218,1069966,https://cch2.org/portal/collections/individual/index.php?occid=1069966,YES,,3818e1d3-b6a4-11e8-b408-001a64db2964,,RSA,PreservedSpecimen,,a9d75ba4-d870-42cc-9c09-fae4a881c823,,2959,Michael Honer,,,flowers & fruits,,Native,,,,,RSA accession #: 757387,,2008-04-11,2008-04-11,2008,04,11,,102,,2008,4,11,,"Coarse E-facing decomposed granite slope below sculpted boulder piles overlooking sandy wash. Mixed mojavean woody scrub with Juniperus californica, Coleogyne ramocissima, Prunus fasciculata, Yucca schidigera, Vigureia parishii, Encelia actonii, Echinocactus engelmannii, Acacia greggii, Ericameria linearifolia, Hymenoclea salsola, Achnatherum speciosum, and common desert annuals in openings of scrub.",,United States,,California,San Bernardino,,BLMHondo Wash: about 4 air-miles W of Flamingo Heights / Landers area. Accessed by driving curvy twisted confusing roads W from Hwy 247 and Hondo St.,4200ft.,34.24605,-116.5101667,NAD83,,,206144,Syntrichopappus fremontii,Asteraceae,Syntrichopappus,,fremontii,,Species,A. Gray,2000,102
2422460858,1632761,https://cch2.org/portal/collections/individual/index.php?occid=1632761,YES,,3818c5b4-b6a4-11e8-b408-001a64db2964,,UCR,PreservedSpecimen,,UCR-BPS-214755,,2959,Michael Honer,,,Flowering,,,,,,,UCR-214755,,2008-04-11,2008-04-11,2008,04,11,,102,,2008,4,11,2008-4-11,"Coarse east-facing decomposed granite slope below sculpted bouldr piles overlooking sandy wash. Mixed mojavean woody scrub with Juniperus californica, Coleogyne ramosissima, Prunus fasciculata, Yucca schidigera, Viguiera parishii, Encelia actoni, Echinocactus engelmannii, Acacia greggii, Ericameria linearifolia, Hymenoclea salsola, Achnatherum speciosum, and common desert annuals in openings of scrub.",,United States,,California,San Bernardino,,"Hondo Wash, c. 4 air-miles west of Flamingo Heights/Landers area, accessed by driving curvy twisted confusing roads west from Hwy 247 and Hondo Street",,34.24611,-116.51,,,,206144,Syntrichopappus fremontii,Asteraceae,Syntrichopappus,,fremontii,,Species,A. Gray,2000,102
415735903,0eba8ea2-ba8b-11e3-8cfe-90b11c41863e,,NO,http://grbio.org/cool/iakn-125z,,,KU,PreservedSpecimen,,0eba8ea2-ba8b-11e3-8cfe-90b11c41863e,363510,,Arnold Tiehm,,,,,,,,,,,,2005-04-12,2005-04-12,2005,04,12,,,,2005,4,12,,,,United States,,Nevada,Nye,,"Bullfrog Hills, 2.2 road mi W of Hwy 95 on the main road to Grapevine Mountains",4160 ft,37.0447222,-116.8038889,WGS84,,,,Syntrichopappus fremontii,Asteraceae,Syntrichopappus,,fremontii,,,,2000,102
2868356158,60258824,https://www.inaturalist.org/observations/60258824,YES,,,,iNaturalist,HumanObservation,,https://www.inaturalist.org/observations/60258824,60258824,,matsonburger,,,,,wild,,,,,,,2008-04-12T11:03:00-07:00,2008-04-12,2008,04,12,18:03:00Z,,,,,,2008/04/12 11:03 AM PDT,,,,US,California,,,,,36.62481446,-118.1136237,EPSG:4326,115,,79308,Syntrichopappus fremontii,Asteraceae,Syntrichopappus,,,,species,,2000,103
2270216931,208669,https://cch2.org/portal/collections/individual/index.php?occid=208669,YES,,3818d95b-b6a4-11e8-b408-001a64db2964,,OBI,PreservedSpecimen,,af155e15-48d4-408f-ad06-5323aa56edc3,OBI176954,784,Melissa Luckow; Rhonda Riggins,,,,,,,,,,29044,,1982-04-13,1982-04-13,1982,04,13,,103,,1982,4,13,13-Apr-82,Grass-atriplex scrublands with some creosote; Uncommon,,United States,,California,Kern,,"0.6 mi E of Calif City Blvd, 3.5 mi SE of Calif City, 7.2 mi W of hwy 58",,35.113339,-117.920406,WGS84,6000,,206144,Syntrichopappus fremontii,Asteraceae,Syntrichopappus,,fremontii,,Species,A. Gray,1980,103
3053398231,3825192,https://cch2.org/portal/collections/individual/index.php?occid=3825192,YES,,3818e0aa-b6a4-11e8-b408-001a64db2964,,SBBG,PreservedSpecimen,,a990e9d2-2097-48c9-940d-6532d7e27233,SBBG180588,6004,R. G. Swinney,,,,,,,,,"Purshia, Salazaria, Yucca whipplei, Yucca brevifolia, Ephedra nevadensis, Eriogonum fasciculatum subsp. polifolium",,,1998-04-14,1998-04-14,1998,04,14,,104,,1998,4,14,14 Apr 1998,shallow NS running cyn in Joshua tree woodland; alluvial fan. Area burned 1996,,United States,,California,Los Angeles,,"San Gabriel Mtns/southern Mojave Desert: Pinon Hills area, 1.1 mi S of Ft Tejon Rd and 150 m W of 237th St, W of Mescal Creek Cyn, Mescal Highlands",4260ft,34.449722,-117.714722,unknown,1000,"34° 26' 59"" N 117° 42' 53"" W; T4N R8W S09 SE/4 NE/4",206144,Syntrichopappus fremontii,Asteraceae,Syntrichopappus,,fremontii,,Species,A. Gray,1990,104
